### ISSUE TITLE
ReversedVPN connections being reset by istio ingress reconfigurations

### ISSUE THREAD

**Issue by ScheererJ** [gardener/gardener#4381]
**How to categorize this issue?**

/area networking
/kind bug
/priority 3

**What happened**:
Each reconfiguration of the `istio-ingress` gateway causes all established vpn connections of clusters on the same seed to be reset/killed. Essentially, a shoot cluster creation/deletion affects all vpn connections of shoot clusters using the same seed.
Below is an example coming from a tcpdump for reset packets in the `istio-ingress` gateway:
```
# tcpdump -ni eth0 'tcp[13] & 4 != 0 and port 8132'
tcpdump: verbose output suppressed, use -v or -vv for full protocol decode
listening on eth0, link-type EN10MB (Ethernet), capture size 262144 bytes
09:04:00.956700 IP 10.243.134.77.8132 > 10.243.176.1.25052: Flags [R], seq 1777556139, win 0, length 0
09:04:00.956922 IP 10.243.134.77.8132 > 10.243.176.1.25052: Flags [R], seq 1777556139, win 0, length 0
09:04:00.957136 IP 10.243.134.77.8132 > 10.243.151.1.32728: Flags [R], seq 677275936, win 0, length 0
09:04:00.957246 IP 10.243.134.77.8132 > 10.243.135.1.50335: Flags [R.], seq 3786421983, ack 1420733703, win 8197, options [nop,nop,TS val 1048444644 ecr 1668804283], length 0
09:04:00.957273 IP 10.243.134.77.8132 > 10.243.135.1.50335: Flags [R], seq 3786421983, win 0, length 0
09:04:00.957323 IP 10.243.134.77.8132 > 10.243.135.1.50335: Flags [R], seq 3786421983, win 0, length 0
09:04:00.957387 IP 10.243.134.77.8132 > 10.243.151.1.32728: Flags [R], seq 677275936, win 0, length 0
09:04:00.957387 IP 10.243.134.77.8132 > 10.243.135.1.50335: Flags [R], seq 3786421983, win 0, length 0
09:04:00.957402 IP 10.243.134.77.8132 > 10.243.135.1.50335: Flags [R], seq 3786421983, win 0, length 0
09:04:00.958070 IP 10.243.134.77.8132 > 10.243.154.1.23669: Flags [R], seq 1450657124, win 0, length 0
09:04:00.958294 IP 10.243.134.77.8132 > 10.243.154.1.23669: Flags [R], seq 1450657124, win 0, length 0
09:04:00.964219 IP 10.243.134.77.8132 > 10.243.165.1.21511: Flags [R], seq 2716506266, win 0, length 0
09:04:00.964565 IP 10.243.134.77.8132 > 10.243.165.1.21511: Flags [R], seq 2716506266, win 0, length 0
09:04:00.965063 IP 10.243.134.77.8132 > 10.243.165.1.21511: Flags [R], seq 2716506422, win 0, length 0
09:04:00.965213 IP 10.243.134.77.8132 > 10.243.165.1.21511: Flags [R], seq 2716506500, win 0, length 0
09:04:00.965242 IP 10.243.134.77.8132 > 10.243.165.1.21511: Flags [R], seq 2716506500, win 0, length 0
09:04:00.965784 IP 10.243.134.77.8132 > 10.243.165.1.21511: Flags [R], seq 2716506812, win 0, length 0
09:04:00.965834 IP 10.243.134.77.8132 > 10.243.165.1.21511: Flags [R], seq 2716506968, win 0, length 0
09:04:00.965876 IP 10.243.134.77.8132 > 10.243.165.1.21511: Flags [R], seq 2716506968, win 0, length 0
09:04:00.965903 IP 10.243.134.77.8132 > 10.243.165.1.21511: Flags [R], seq 2716506968, win 0, length 0
09:04:00.965943 IP 10.243.134.77.8132 > 10.243.165.1.21511: Flags [R], seq 2716506968, win 0, length 0
09:04:00.965963 IP 10.243.134.77.8132 > 10.243.165.1.21511: Flags [R], seq 2716506968, win 0, length 0
09:04:01.179392 IP 10.243.134.77.8132 > 10.243.165.1.21511: Flags [R], seq 2716506969, win 0, length 0
09:07:09.990264 IP 10.243.134.77.8132 > 10.243.152.1.52484: Flags [R], seq 250348339, win 0, length 0
```
If `debug` level logging was enabled on the `istio-ingress` gateway it showed that a configuration change was performed and therefore connections were drained. Approximately 40-50 seconds later the draining was complete (with another log message) and all connections were terminated.
In the `vpn-seed-server` and `vpn-shoot` logs, you see corresponding connections reset messages:
```
Fri Jul 16 12:29:10 2021 vpn-shoot-client/10.243.130.40:40706 Connection reset, restarting [0]
```
```
Fri Jul 16 12:29:10 2021 Connection reset, restarting [0]
```

**What you expected to happen**:
Reconfigurations of the `istio-ingress` gateway should not affect existing vpn connections and certainly not disrupt/kill them. Cluster creation/deletion should not affect the `ReversedVPN` tunnel connection of other clusters on the same seed.

**How to reproduce it (as minimally and precisely as possible)**:
1. Have a cluster running on a seed with `ReversedVPN` being enabled (per cluster or per gardenlet feature gate)
2. Create a second cluster on the same seed with `ReversedVPN` being enabled
3. Watch the VPN connection of the first cluster being disrupted.

This works the same with cluster deletion or a larger amount of clusters.

**Anything else we need to know?**:
The behaviour is documented by envoy proxy here: https://www.envoyproxy.io/docs/envoy/latest/intro/arch_overview/operations/draining

It might affect the SNI infrastructure in the same way.

**Environment**:

- Gardener version: v1.28-dev
- Kubernetes version (use `kubectl version`): v1.20.8

**Comment by ScheererJ** [comment]
@mvladev Feel free to share how this issue affects/does not affect the SNI infrastructure.

**Comment by ScheererJ** [comment]
Due to #4362 this issue is less relevant as the overall connection will continue to exist for established connections and new connections have a bigger buffer until an error is reported back.

**Comment by vlerenc** [comment]
@mvladev Could you please update this ticket?

Also, @marwinski opened https://github.com/gardener/vpn2/issues/4 which seems to describe the same problems as https://github.com/gardener/gardener/issues/4381 and https://github.com/gardener/gardener/issues/4382 opened by @ScheererJ . Which ones do we keep?
