### ISSUE TITLE
Random failures when accessing virtual Garden in local Gardener Operator setup on Mac

### ISSUE THREAD

**Issue by ScheererJ** [gardener/gardener#8930]
**How to categorize this issue?**

/area networking
/area dev-productivity
/kind bug

**What happened**:

When running gardener operator locally on a mac via `make kind-operator-up && make operator-up && kubectl apply -f example/operator/20-garden.yaml` (see https://github.com/gardener/gardener/blob/master/docs/concepts/operator.md for details) connections to the virtual garden cluster may fail with errors like:

```
% kubectl get ns
Unable to connect to the server: net/http: TLS handshake timeout
```

These issues happen somewhat randomly. Some operations may succeed, but others may fail. Retrying an operation may eventually lead to success.

**What you expected to happen**:

The virtual garden should be accessible and available in the local gardener operator setup on mac.

**How to reproduce it (as minimally and precisely as possible)**:

Run the following:

```
make kind-operator-up && make operator-up && kubectl apply -f example/operator/20-garden.yaml
```

Wait for the garden to be reconciled. Then execute something like the following

```
kubectl -n garden get secret gardener -o jsonpath={.data.kubeconfig} | base64 -d > /tmp/virtual-garden-kubeconfig
kubectl --kubeconfig /tmp/virtual-garden-kubeconfig get namespaces
```

Executing the last line multiple times will lead to an error/timeout eventually.

**Anything else we need to know?**:

This was worker with Docker Desktop including version v4.22.1.
Starting with version v4.23.0 of Docker Desktop it fails randomly.

**Environment**:

- Gardener version:
- Kubernetes version (use `kubectl version`):
- Cloud provider or hardware configuration:
- Others:

**Comment by ScheererJ** [comment]
The local gardener operator setup uses three docker containers:

```
% docker ps
CONTAINER ID   IMAGE                  COMMAND                  CREATED          STATUS          PORTS                                                                                                NAMES
0bb2110f3681   kindest/node:v1.28.0   "/usr/local/bin/entr…"   24 hours ago     Up 56 minutes                                                                                                        gardener-operator-local-worker2
476087bf15bf   kindest/node:v1.28.0   "/usr/local/bin/entr…"   24 hours ago     Up 56 minutes                                                                                                        gardener-operator-local-worker
e357c16ceea9   kindest/node:v1.28.0   "/usr/local/bin/entr…"   24 hours ago     Up 56 minutes   0.0.0.0:5001->5001/tcp, 127.0.0.1:50053->6443/tcp, 0.0.0.0:443->30443/tcp, 0.0.0.0:8448->30448/tcp   gardener-operator-local-control-plane
```

Each of the containers act as a node in the gardener operator `kind` kubernetes cluster. The traffic from the local mac gets into the containers via port mappings on the control plane container.

The virtual garden API server is exposed via istio ingress gateways. There are two replicas per kubernetes node:

```
% kubectl -n virtual-garden-istio-ingress get po -o wide
NAME                                    READY   STATUS    RESTARTS      AGE   IP             NODE                                    NOMINATED NODE   READINESS GATES
istio-ingressgateway-5797f7cfb9-4x9wc   1/1     Running   4 (58m ago)   23h   10.1.155.99    gardener-operator-local-worker2         <none>           <none>
istio-ingressgateway-5797f7cfb9-5bkr5   1/1     Running   4 (58m ago)   23h   10.1.212.2     gardener-operator-local-control-plane   <none>           <none>
istio-ingressgateway-5797f7cfb9-7l8f4   1/1     Running   4 (58m ago)   23h   10.1.212.12    gardener-operator-local-control-plane   <none>           <none>
istio-ingressgateway-5797f7cfb9-9vhn7   1/1     Running   4 (58m ago)   23h   10.1.155.86    gardener-operator-local-worker2         <none>           <none>
istio-ingressgateway-5797f7cfb9-grhnl   1/1     Running   4 (58m ago)   23h   10.1.254.117   gardener-operator-local-worker          <none>           <none>
istio-ingressgateway-5797f7cfb9-pgdrj   1/1     Running   4 (58m ago)   23h   10.1.254.123   gardener-operator-local-worker          <none>           <none>
```

Traffic coming from the local mac gets redistributed on the control plane node to one of the istio ingress gateway pods by `iptables` rules created by `kube-proxy`.

The issue occurs when the target is located on another node, i.e. when target is not on the control plane node.

In the kubernetes cluster pod-to-pod communication across nodes is achieved via ip-in-ip tunneling operated by `calico`. Interestingly, we can see the packets destined for remote nodes leaving the control plane node and arriving on the target node.

Control plane node:
```
tcpdump: data link type LINUX_SLL2
tcpdump: verbose output suppressed, use -v[v]... for full protocol decode
listening on any, link-type LINUX_SLL2 (Linux cooked v2), snapshot length 262144 bytes
14:10:45.827722 eth0  In  IP 192.168.65.1.24649 > 172.18.0.4.30443: Flags [S], seq 3968206941, win 65408, options [mss 65495,nop,nop,TS val 3712640714 ecr 0,nop,wscale 7], length 0
14:10:45.827753 tunl0 Out IP 10.1.212.0.16459 > 10.1.155.86.9443: Flags [S], seq 3968206941, win 65408, options [mss 65495,nop,nop,TS val 3712640714 ecr 0,nop,wscale 7], length 0
14:10:45.827762 eth0  Out IP 172.18.0.4 > 172.18.0.2: IP 10.1.212.0.16459 > 10.1.155.86.9443: Flags [S], seq 3968206941, win 65408, options [mss 65495,nop,nop,TS val 3712640714 ecr 0,nop,wscale 7], length 0
```

Worker node:
```
tcpdump: data link type LINUX_SLL2
tcpdump: verbose output suppressed, use -v[v]... for full protocol decode
listening on any, link-type LINUX_SLL2 (Linux cooked v2), snapshot length 262144 bytes
14:10:45.827790 eth0  In  IP 172.18.0.4 > 172.18.0.2: IP 10.1.212.0.16459 > 10.1.155.86.9443: Flags [S], seq 3968206941, win 65408, options [mss 65495,nop,nop,TS val 3712640714 ecr 0,nop,wscale 7], length 0
14:10:45.827803 tunl0 In  IP 10.1.212.0.16459 > 10.1.155.86.9443: Flags [S], seq 3968206941, win 65408, options [mss 65495,nop,nop,TS val 3712640714 ecr 0,nop,wscale 7], length 0
```

In the working scenario with docker < v4.23.0, the packet is then forwarded to the corresponding calico device (`cali*`) similar to the local control plane case (except that the `tunl0` device is in between for remote communication):

```
tcpdump: data link type LINUX_SLL2
tcpdump: verbose output suppressed, use -v[v]... for full protocol decode
listening on any, link-type LINUX_SLL2 (Linux cooked v2), snapshot length 262144 bytes
14:16:57.190030 eth0  In  IP 192.168.65.1.24668 > 172.18.0.4.30443: Flags [S], seq 3373297164, win 65408, options [mss 65495,nop,nop,TS val 3713012077 ecr 0,nop,wscale 7], length 0
14:16:57.190062 calidc552c0108f Out IP 10.1.212.0.25489 > 10.1.212.2.9443: Flags [S], seq 3373297164, win 65408, options [mss 65495,nop,nop,TS val 3713012077 ecr 0,nop,wscale 7], length 0
```

Looking at the `iptables` rules, we can see that the packets get dropped by the following (or similar) rules:

```
[8:480] -A cali-tw-calia05cc62e557 -m comment --comment "cali:G-PVls6GXiKrPsK-" -m conntrack --ctstate INVALID -j DROP
```

As the packets are related to new connections and the `conntrack` table does not seem to be full it is unclear why they are handled as `INVALID` with regards to their connection tracking state. (In the working scenario with a docker release prior to v4.23.0, no packets hits this rule, but the initial packets are allowed by following rules.)
